;Titre de Quête;Nombre d'étape;Etape 1;Etape 2;Etape 3;
Quête 1 FR;A l'aventure;1;Trouver la première radio à côté du lac.;;;
Quête 1 EN;To the adventure;1;Find the first radio next to the lake;;;
;;;;;;
Quête 2 FR;Encore plus fort;3;Trouver la seconde radio à côté des bancs.;Trouver la troisième radio à côté d'une des maisons.;Demo Finie !;
Quête 2 EN;Even stronger;3;Find the second radio next to the benches.;Find the third  radio next to one of the houses.;Demo Finished !;
;;;;;;
Quête 3 FR;Jenny du batiment;2;Ne sois pas dupé par les caillux que je possède;Je demeure je demeure jenny du quartier!;;
Quête 3 EN;Jenny from the block;2;Don't be fooled by the rocks that I got;I'm still I'm still Jenny from the block;;
