Nom ENT;Description;Valeurs;Titre dernière prod;Description dernière prod;Titre avant dernière prod;Description avant derniere prod;¤
Les Crafteurs FR;"À leur départ, Les Crafteurs sont constitués d'Alex, Joris et Simon, qui se rencontrent pendant leurs études de graphisme et s’amusent à créer ensemble des petits projets étudiants déjantés, avec une connaissance approximative des logiciels, des fonds verts en nappe Monoprix, et des musiques entièrement faîtes à la bouche.

Ils seront ensuite rejoints par Théo, jeune étudiant curieux et polyvalent, qui deviendra plus tard un membre permanent de l’équipe, notamment grâce à son comique de geste particulier, et son talent pour les kick-flips.";Nous sommes 4 créatifs basé à Lille, auteurs de Toasterball, un jeu de sport multijoueur avec des grille-pains. Nous travaillons aussi sur tout untas d'autres projets sympas, pour nos clients ou pour nous-même.;Toasterball;Une balle, deux buts, et… des grilles-pains. Bienvenue dans Toasterball. Affontez-vous amis jusqu'à 4 joueurs dans ce tournoi un peu inhabituel, où les grille-pains sont des atlhètes, et oùles lois de la physique osnt en option.;;;¤
Les Crafteurs EN;"When they left, Les Crafteurs were made up of Alex, Joris and Simon, who met during their graphic design studies and had fun creating together small crazy student projects, with an approximate knowledge of software, green backgrounds in a tablecloth Monoprix, and music made entirely by mouth.

They will then be joined by Theo, a curious and versatile young student, who will later become a permanent member of the team, in particular thanks to his particular comic gesture, and his talent for kick-flips.";We are 4 creatives based in Lille, authors of Toasterball, a multiplayer sports game with toasters. We also work on a whole lot of other cool projects, for our clients or for ourselves.;Toasterball;One ball, two goals, and… toasters. Welcome to Toasterball. Face off against friends with up to 4 players in this somewhat unusual tournament, where toasters are athletes, and the laws of physics are optional.;;;¤
-;;;;;;;
